{
  "_modelName": "tower_t01",
  "_team": 1,
  "_selectable": true,
  "_targetable": true,
  "_currentHp": 1000,
  "_currentStateId": "default",
  "_entityStateListModel": {
    "_elements": [
      {
        "_id": "default",
        "_mass": -1,
        "_radius": 23,
        "_collisionRadius": 23,
        "_viewRadius": 600,
        "_selectTargetRadius": 250,
        "_groundSpeed": 0,
        "_hp": 1000,
        "_graphicUrl": "assets/graphics/images/tower_t01.png",
        "_graphicOffset": {
          "_x": -4,
          "_y": 35
        },
        "_rotateGraphicOnMove": false
      },
      {
        "_id": "inconstrucion",
        "_mass": -1,
        "_radius": 23,
        "_collisionRadius": 23,
        "_groundSpeed": 0,
        "_hp": 1000,
        "_graphicUrl": "assets/graphics/images/tower_t01.png",
        "_graphicOffset": {
          "_x": -4,
          "_y": 35
        },
        "_rotateGraphicOnMove": false
      }
    ]
  }
}