{
  "_modelName": "bush02",
  "_team": 0,
  "_selectable": true,
  "_targetable": true,
  "_currentHp": 100,
  "_currentStateId": "default",
  "_entityStateListModel": {
    "_elements": [
      {
        "_id": "default",
        "_mass": -1,
        "_radius": 20,
        "_collisionRadius": 20,
        "_groundSpeed": 0,
        "_hp": 100,
        "_graphicUrl": "assets/graphics/images/bush02.png",
        "_graphicOffset": {
          "_x": 0,
          "_y": 20
        },
        "_rotateGraphicOnMove": false
      }
    ]
  }
}
